{
  "chapter_count": 4,
  "chapter_index": 3,
  "chapter_id": "chapter-4",
  "reference_id": "ppmodel_44444444444444444444444444444444",
  "sha256": "bbbbbbbbbbbbbbbbbbbbbbbbbbbbbbbbbbbbbbbbbbbbbbbbbbbbbbbbbbbbbbbb",
  "source_image_sha256": "3333333333333333333333333333333333333333333333333333333333333333",
  "source_text_sha256": "cccccccccccccccccccccccccccccccccccccccccccccccccccccccccccccccc",
  "source_text": "{\"title\":\"Chapter 4\",\"summary\":\"Fictional example\",\"sections\":[\"One complete section.\"],\"tensions\":[\"One tension.\"],\"resources\":[\"One resource.\"],\"counterExpression\":\"One alternative.\"}",
  "program_sha256": "aaaaaaaaaaaaaaaaaaaaaaaaaaaaaaaaaaaaaaaaaaaaaaaaaaaaaaaaaaaaaaaa",
  "compiler_version": "portrait-mesh-compiler/v2",
  "authoring": "codex-parametric/v2",
  "document_revision": "revision-fictional"
}
